"DESCRIPTION","DURATION IN MS","NAME","PARENT SUITE","START TIME","STATUS","STOP TIME","SUB SUITE","SUITE","TEST CLASS","TEST METHOD"
"Tests writing data to mongos gets propagated to shards.","3336","test_sharding","tests.integration.sharding_tests","Wed Sep 04 01:42:30 UTC 2024","passed","Wed Sep 04 01:42:34 UTC 2024","","test_sharding","",""
"Test superuser actions (ie creating a new user and creating a new database).","3740","test_user_with_extra_roles","tests.integration.relation_tests","Wed Sep 04 01:41:59 UTC 2024","passed","Wed Sep 04 01:42:03 UTC 2024","","test_charm_relations","",""
"Test that in general, there is no change when password validation fails.","3298","test_no_password_change_on_invalid_password","tests.integration","Wed Sep 04 01:48:05 UTC 2024","passed","Wed Sep 04 01:48:09 UTC 2024","","test_charm","",""
"Verifies that the charm goes into blocked status when s3 config options are incorrect.","88483","test_blocked_incorrect_conf","tests.integration.backup_tests","Wed Sep 04 01:36:38 UTC 2024","passed","Wed Sep 04 01:38:06 UTC 2024","","test_backups","",""
"","800279","test_restore_new_cluster[GCP]","tests.integration.backup_tests","Wed Sep 04 02:07:15 UTC 2024","passed","Wed Sep 04 02:20:35 UTC 2024","","test_backups","",""
"Tests that sharded cluster can successfully create and list backups.","7133","test_create_and_list_backups_in_cluster","tests.integration.backup_tests","Wed Sep 04 01:40:13 UTC 2024","passed","Wed Sep 04 01:40:21 UTC 2024","","test_sharding_backups","",""
"","241067","test_restore_new_cluster[AWS]","tests.integration.backup_tests","Wed Sep 04 02:02:43 UTC 2024","passed","Wed Sep 04 02:06:44 UTC 2024","","test_backups","",""
"","259174","test_full_cluster_crash","tests.integration.ha_tests","Wed Sep 04 01:45:50 UTC 2024","passed","Wed Sep 04 01:50:09 UTC 2024","","test_ha","",""
"Test that the password can't be set to an empty string.","4098","test_empty_password","tests.integration","Wed Sep 04 01:48:01 UTC 2024","passed","Wed Sep 04 01:48:05 UTC 2024","","test_charm","",""
"Build and deploy a sharded cluster.","127687","test_build_and_deploy","tests.integration.tls_tests","Wed Sep 04 01:33:22 UTC 2024","passed","Wed Sep 04 01:35:30 UTC 2024","","test_sharding_tls","",""
"Verify unique clusters do not share DBs.","75965","test_unique_cluster_dbs","tests.integration.ha_tests","Wed Sep 04 01:41:53 UTC 2024","passed","Wed Sep 04 01:43:09 UTC 2024","","test_ha","",""
"","20","test_application_is_up[1]","tests.integration","Wed Sep 04 01:34:45 UTC 2024","passed","Wed Sep 04 01:34:45 UTC 2024","","test_charm","",""
"Sanity check that endpoints are running.","379","test_endpoints","tests.integration.metrics_tests","Wed Sep 04 01:34:42 UTC 2024","passed","Wed Sep 04 01:34:43 UTC 2024","","test_metrics","",""
"Verify removed applications no longer have access to the database.","21175","test_removed_relation_no_longer_has_access","tests.integration.relation_tests","Wed Sep 04 01:44:09 UTC 2024","passed","Wed Sep 04 01:44:30 UTC 2024","","test_charm_relations","",""
"Build and deploy three units of MongoDB and one unit of TLS.","79578","test_build_and_deploy","tests.integration.metrics_tests","Wed Sep 04 01:33:23 UTC 2024","passed","Wed Sep 04 01:34:42 UTC 2024","","test_metrics","",""
"Build and deploy three units of MongoDB and one test unit.","142230","test_build_and_deploy","tests.integration.ha_tests","Wed Sep 04 01:33:49 UTC 2024","passed","Wed Sep 04 01:36:11 UTC 2024","","test_ha","",""
"Test verifies that only the leader can set a password, while all units can read it.","12226","test_only_leader_can_set_while_all_can_read_password_secret","tests.integration","Wed Sep 04 01:47:44 UTC 2024","passed","Wed Sep 04 01:47:56 UTC 2024","","test_charm","",""
"Tests existence of primary and verifies the application is running as a replica set.

    By retrieving information about the primary this test inherently tests password retrieval.
    ","16364","test_application_primary","tests.integration","Wed Sep 04 01:34:45 UTC 2024","passed","Wed Sep 04 01:35:02 UTC 2024","","test_charm","",""
"Tests safe removal of a shard that is not primary.","598576","test_removal_of_non_primary_shard","tests.integration.sharding_tests","Wed Sep 04 01:46:48 UTC 2024","passed","Wed Sep 04 01:56:46 UTC 2024","","test_sharding","",""
"Check consistency, ie write to primary, read data from secondaries.","5362","test_replication_across_members","tests.integration.ha_tests","Wed Sep 04 01:41:42 UTC 2024","passed","Wed Sep 04 01:41:48 UTC 2024","","test_ha","",""
"Tests that the cluster can be integrated with TLS.","445835","test_built_cluster_with_tls","tests.integration.tls_tests","Wed Sep 04 01:35:30 UTC 2024","passed","Wed Sep 04 01:42:56 UTC 2024","","test_sharding_tls","",""
"Test the data consistency between the primary and secondaries.

    Verifies that after writing data to the primary the data on
    the secondaries match.
    ","54732","test_replication_data_consistency","tests.integration","Wed Sep 04 01:50:38 UTC 2024","passed","Wed Sep 04 01:51:33 UTC 2024","","test_charm","",""
"Tests that sharded Charmed MongoDB cluster supports restores.","560905","test_restore_backup","tests.integration.backup_tests","Wed Sep 04 01:45:40 UTC 2024","passed","Wed Sep 04 01:55:01 UTC 2024","","test_sharding_backups","",""
"","16","test_application_is_up[2]","tests.integration","Wed Sep 04 01:34:45 UTC 2024","passed","Wed Sep 04 01:34:45 UTC 2024","","test_charm","",""
"With writes in the DB test creating a backup while another one is running.

    Note that before creating the second backup we change the bucket and change the s3 storage
    from AWS to GCP. This test verifies that the first backup in AWS is made, the second backup
    in GCP is made, and that before the second backup is made that pbm correctly resyncs.
    ","1098434","test_multi_backup","tests.integration.backup_tests","Wed Sep 04 01:39:33 UTC 2024","passed","Wed Sep 04 01:57:52 UTC 2024","","test_backups","",""
"","273601","test_full_cluster_restart","tests.integration.ha_tests","Wed Sep 04 01:50:15 UTC 2024","passed","Wed Sep 04 01:54:48 UTC 2024","","test_ha","",""
"Tests that sharded cluster can successfully create and list backups.","294117","test_rotate_backup_password","tests.integration.backup_tests","Wed Sep 04 01:40:24 UTC 2024","passed","Wed Sep 04 01:45:18 UTC 2024","","test_sharding_backups","",""
"Tests the integration of cluster components works without error.","372620","test_cluster_active","tests.integration.sharding_tests","Wed Sep 04 01:36:18 UTC 2024","passed","Wed Sep 04 01:42:30 UTC 2024","","test_sharding","",""
"","46132","test_restart_db_process","tests.integration.ha_tests","Wed Sep 04 01:44:59 UTC 2024","passed","Wed Sep 04 01:45:45 UTC 2024","","test_ha","",""
"Build the charm-under-test and deploy it together with related charms.

    Assert on the unit status before any relations/configurations take place.
    ","76705","test_build_and_deploy","tests.integration","Wed Sep 04 01:33:28 UTC 2024","passed","Wed Sep 04 01:34:45 UTC 2024","","test_charm","",""
"Test basic functionality of database relation interface.","40937","test_database_relation_with_charm_libraries","tests.integration.relation_tests","Wed Sep 04 01:34:40 UTC 2024","passed","Wed Sep 04 01:35:21 UTC 2024","","test_charm_relations","",""
"Test that log are being rotated.","759064","test_log_rotate","tests.integration","Wed Sep 04 01:35:02 UTC 2024","passed","Wed Sep 04 01:47:42 UTC 2024","","test_charm","",""
"Test verifies that the monitor user can perform operations such as 'rs.conf()'.","2030","test_monitor_user","tests.integration","Wed Sep 04 01:47:42 UTC 2024","passed","Wed Sep 04 01:47:44 UTC 2024","","test_charm","",""
"Tests clusters behavior when scaling down a minority and removing a primary replica.","98916","test_scale_down_capablities","tests.integration.ha_tests","Wed Sep 04 01:39:58 UTC 2024","passed","Wed Sep 04 01:41:37 UTC 2024","","test_ha","",""
"Verifies that when the cluster is formed a the user is removed.","0","test_disconnect_from_cluster_removes_user","tests.integration.sharding_tests","Wed Sep 04 01:50:12 UTC 2024","skipped","Wed Sep 04 01:50:12 UTC 2024","","test_mongos","",""
"Build and deploy one unit of MongoDB.","153521","test_build_and_deploy","tests.integration.backup_tests","Wed Sep 04 01:33:22 UTC 2024","passed","Wed Sep 04 01:35:56 UTC 2024","","test_backups","",""
"Verifies that the app metadata changes with db relation joined and departed events.","397545","test_app_relation_metadata_change","tests.integration.relation_tests","Wed Sep 04 01:35:21 UTC 2024","passed","Wed Sep 04 01:41:59 UTC 2024","","test_charm_relations","",""
"Verify rotating tls private keys restarts mongod with new certificates.

    This test rotates tls private keys to user specified keys.
    ","170571","test_set_tls_key","tests.integration.tls_tests","Wed Sep 04 01:39:33 UTC 2024","passed","Wed Sep 04 01:42:24 UTC 2024","","test_tls","",""
"Test that an application can connect to different clusters of the same database.","26359","test_an_application_can_connect_to_multiple_database_clusters","tests.integration.relation_tests","Wed Sep 04 01:42:49 UTC 2024","passed","Wed Sep 04 01:43:15 UTC 2024","","test_charm_relations","",""
"Verify each unit has TLS enabled after relating to the TLS application.","77734","test_enable_tls","tests.integration.tls_tests","Wed Sep 04 01:35:39 UTC 2024","passed","Wed Sep 04 01:36:57 UTC 2024","","test_tls","",""
"Build and deploy a sharded cluster.","180735","test_build_and_deploy","tests.integration.sharding_tests","Wed Sep 04 01:33:17 UTC 2024","passed","Wed Sep 04 01:36:18 UTC 2024","","test_sharding","",""
"Tests juju remove-unit functionality.

    This test verifies:
    1. multiple units can be removed while still maintaining a majority (ie remove a minority)
    2. Replica set hosts are properly updated on unit removal
    ","52861","test_scale_down","tests.integration","Wed Sep 04 01:49:09 UTC 2024","passed","Wed Sep 04 01:50:02 UTC 2024","","test_charm","",""
"","47150","test_kill_db_process","tests.integration.ha_tests","Wed Sep 04 01:43:14 UTC 2024","passed","Wed Sep 04 01:44:01 UTC 2024","","test_ha","",""
"Tests that removing a shard application safely drains data.

    It is preferred that users remove-relations instead of removing shard applications. But we do
    support removing shard applications in a safe way.
    ","776367","test_unconventual_shard_removal","tests.integration.sharding_tests","Wed Sep 04 01:56:46 UTC 2024","broken","Wed Sep 04 02:09:43 UTC 2024","","test_sharding","",""
"Verify that endpoints still function correctly after the monitor user password changes.","28907","test_endpoints_new_password","tests.integration.metrics_tests","Wed Sep 04 01:34:43 UTC 2024","passed","Wed Sep 04 01:35:12 UTC 2024","","test_metrics","",""
"","528236","test_tls_inconsistent_rels","tests.integration.tls_tests","Wed Sep 04 02:02:58 UTC 2024","passed","Wed Sep 04 02:11:47 UTC 2024","","test_sharding_tls","",""
"Test that two different application connect to the database with different credentials.","46355","test_two_applications_doesnt_share_the_same_relation_data","tests.integration.relation_tests","Wed Sep 04 01:42:03 UTC 2024","passed","Wed Sep 04 01:42:49 UTC 2024","","test_charm_relations","",""
"Tests that the cluster can safely set the operator password.","57126","test_set_operator_password[backup]","tests.integration.sharding_tests","Wed Sep 04 01:43:27 UTC 2024","passed","Wed Sep 04 01:44:24 UTC 2024","","test_sharding","",""
"Verifies charm goes into active status when s3 config and creds options are correct.","76737","test_ready_correct_conf","tests.integration.backup_tests","Wed Sep 04 01:38:06 UTC 2024","passed","Wed Sep 04 01:39:23 UTC 2024","","test_backups","",""
"Build and deploy a sharded cluster.","68036","test_build_and_deploy","tests.integration.sharding_tests","Wed Sep 04 01:33:52 UTC 2024","passed","Wed Sep 04 01:35:00 UTC 2024","","test_mongos","",""
"Verify rotating tls private keys restarts mongod with new certificates.

    This test rotates tls private keys to randomly generated keys.
    ","156256","test_rotate_tls_key","tests.integration.tls_tests","Wed Sep 04 01:36:57 UTC 2024","passed","Wed Sep 04 01:39:33 UTC 2024","","test_tls","",""
"Verifies that database units with attached storage correctly repurpose storage.

    It is not enough to verify that Juju attaches the storage. Hence test checks that the mongod
    properly uses the storage that was provided. (ie. doesn't just re-sync everything from
    primary, but instead computes a diff between current storage and primary storage.)
    ","130987","test_storage_re_use","tests.integration.ha_tests","Wed Sep 04 01:36:14 UTC 2024","passed","Wed Sep 04 01:38:25 UTC 2024","","test_ha","",""
"Verify that a shard can only be related to one config server.","30627","test_only_one_config_server_relation","tests.integration.sharding_tests","Wed Sep 04 01:35:28 UTC 2024","passed","Wed Sep 04 01:35:59 UTC 2024","","test_sharding_relations","",""
"Build and deploy a sharded cluster.","100894","test_build_and_deploy","tests.integration.sharding_tests","Wed Sep 04 01:33:47 UTC 2024","passed","Wed Sep 04 01:35:28 UTC 2024","","test_sharding_relations","",""
"Tests juju add-unit functionality.

    Verifies that when a new unit is added to the MongoDB application that it is added to the
    MongoDB replica set configuration.
    ","82664","test_scale_up_capablities","tests.integration.ha_tests","Wed Sep 04 01:38:31 UTC 2024","passed","Wed Sep 04 01:39:53 UTC 2024","","test_ha","",""
"Verifies integrating a shard to s3-integrator fails.","2416","test_shard_s3_relation","tests.integration.sharding_tests","Wed Sep 04 01:37:14 UTC 2024","passed","Wed Sep 04 01:37:16 UTC 2024","","test_sharding_relations","",""
"Verifies that the charm goes into blocked status when s3 creds are incorrect.","42153","test_blocked_incorrect_creds","tests.integration.backup_tests","Wed Sep 04 01:35:56 UTC 2024","passed","Wed Sep 04 01:36:38 UTC 2024","","test_backups","",""
"","7171","test_create_and_list_backups","tests.integration.backup_tests","Wed Sep 04 01:39:23 UTC 2024","passed","Wed Sep 04 01:39:30 UTC 2024","","test_backups","",""
"Scale up and down the application and verify the replica set is healthy.","779090","test_long_scale_up_scale_down_units","tests.integration","Wed Sep 04 01:34:53 UTC 2024","passed","Wed Sep 04 01:47:52 UTC 2024","","test_teardown","",""
"","325771","test_network_cut","tests.integration.ha_tests","Wed Sep 04 01:55:16 UTC 2024","passed","Wed Sep 04 02:00:42 UTC 2024","","test_ha","",""
"Test that audit log was created and contains actual audit data.","889","test_audit_log","tests.integration","Wed Sep 04 01:35:02 UTC 2024","passed","Wed Sep 04 01:35:02 UTC 2024","","test_charm","",""
"Build the charm-under-test and deploy it to the model.

    Assert that the application is active and the replica set is healthy.
    ","57561","test_build_and_deploy","tests.integration","Wed Sep 04 01:33:55 UTC 2024","passed","Wed Sep 04 01:34:53 UTC 2024","","test_teardown","",""
"Verifies that using a replica as a shard fails.","26434","test_replication_config_server_relation","tests.integration.sharding_tests","Wed Sep 04 01:36:25 UTC 2024","passed","Wed Sep 04 01:36:51 UTC 2024","","test_sharding_relations","",""
"Build and deploy three units of MongoDB and one unit of TLS.","119049","test_build_and_deploy","tests.integration.tls_tests","Wed Sep 04 01:33:40 UTC 2024","passed","Wed Sep 04 01:35:39 UTC 2024","","test_tls","",""
"Tests that the cluster can be integrated with TLS.","559743","test_tls_then_build_cluster","tests.integration.tls_tests","Wed Sep 04 01:53:39 UTC 2024","passed","Wed Sep 04 02:02:58 UTC 2024","","test_sharding_tls","",""
"Test that an application can request additional databases using the same interface.","25091","test_an_application_can_request_multiple_databases","tests.integration.relation_tests","Wed Sep 04 01:43:44 UTC 2024","passed","Wed Sep 04 01:44:09 UTC 2024","","test_charm_relations","",""
"Verifies that using a replica as a config-server fails.","22483","test_replication_shard_relation","tests.integration.sharding_tests","Wed Sep 04 01:36:51 UTC 2024","passed","Wed Sep 04 01:37:14 UTC 2024","","test_sharding_relations","",""
"Verify that endpoint still function correctly after a network cut.","88249","test_endpoints_network_cut","tests.integration.metrics_tests","Wed Sep 04 01:35:30 UTC 2024","passed","Wed Sep 04 01:36:58 UTC 2024","","test_metrics","",""
"Tests that the cluster can disable TLS.","36696","test_disable_cluster_with_tls","tests.integration.tls_tests","Wed Sep 04 01:53:02 UTC 2024","passed","Wed Sep 04 01:53:39 UTC 2024","","test_sharding_tls","",""
"Verify that sharding components cannot use the DB relation.","26286","test_cannot_use_db_relation","tests.integration.sharding_tests","Wed Sep 04 01:35:59 UTC 2024","passed","Wed Sep 04 01:36:25 UTC 2024","","test_sharding_relations","",""
"Test that an application can connect to different clusters of the same database.","28697","test_an_application_can_connect_to_multiple_aliased_database_clusters","tests.integration.relation_tests","Wed Sep 04 01:43:15 UTC 2024","passed","Wed Sep 04 01:43:44 UTC 2024","","test_charm_relations","",""
"","53","test_application_is_up[0]","tests.integration","Wed Sep 04 01:34:45 UTC 2024","passed","Wed Sep 04 01:34:45 UTC 2024","","test_charm","",""
"Tests juju add-unit functionality.

    Verifies that when a new unit is added to the MongoDB application that it is added to the
    MongoDB replica set configuration.
    ","60641","test_scale_up","tests.integration","Wed Sep 04 01:48:09 UTC 2024","passed","Wed Sep 04 01:49:09 UTC 2024","","test_charm","",""
"","47836","test_freeze_db_process","tests.integration.ha_tests","Wed Sep 04 01:44:06 UTC 2024","passed","Wed Sep 04 01:44:54 UTC 2024","","test_ha","",""
"Simple backup tests that verifies that writes are correctly restored.","229084","test_restore","tests.integration.backup_tests","Wed Sep 04 01:58:23 UTC 2024","passed","Wed Sep 04 02:02:12 UTC 2024","","test_backups","",""
"Tests that the cluster can safely set the operator password.","53294","test_set_operator_password[operator]","tests.integration.sharding_tests","Wed Sep 04 01:42:34 UTC 2024","passed","Wed Sep 04 01:43:27 UTC 2024","","test_sharding","",""
"Verifies that when the cluster is formed a new user is created.","911707","test_connect_to_cluster_creates_user","tests.integration.sharding_tests","Wed Sep 04 01:35:00 UTC 2024","broken","Wed Sep 04 01:50:12 UTC 2024","","test_mongos","",""
"","3097","test_shards_cannot_run_backup_actions","tests.integration.backup_tests","Wed Sep 04 01:40:21 UTC 2024","passed","Wed Sep 04 01:40:24 UTC 2024","","test_sharding_backups","",""
"Verify each unit has TLS disabled after removing relation to the TLS application.","50371","test_disable_tls","tests.integration.tls_tests","Wed Sep 04 01:42:24 UTC 2024","passed","Wed Sep 04 01:43:14 UTC 2024","","test_tls","",""
"Test verifies that we can set and retrieve the correct password using Juju 3.x secrets.","5398","test_reset_and_get_password_secret_same_as_cli","tests.integration","Wed Sep 04 01:47:56 UTC 2024","passed","Wed Sep 04 01:48:01 UTC 2024","","test_charm","",""
"Verifies connecting a replica to a mongos router fails.","0","test_replication_mongos_relation","tests.integration.sharding_tests","Wed Sep 04 01:37:14 UTC 2024","skipped","Wed Sep 04 01:37:14 UTC 2024","","test_sharding_relations","",""
"Deploy both charms (application and database) to use in the tests.","79685","test_deploy_charms","tests.integration.relation_tests","Wed Sep 04 01:33:21 UTC 2024","passed","Wed Sep 04 01:34:40 UTC 2024","","test_charm_relations","",""
"Verifies that after changing the backup password the pbm tool is updated and functional.","51749","test_update_backup_password","tests.integration.backup_tests","Wed Sep 04 02:20:38 UTC 2024","passed","Wed Sep 04 02:21:29 UTC 2024","","test_backups","",""
"Tests that sharded cluster can be configured for s3 configurations.","301204","test_set_credentials_in_cluster","tests.integration.backup_tests","Wed Sep 04 01:35:12 UTC 2024","passed","Wed Sep 04 01:40:13 UTC 2024","","test_sharding_backups","",""
"Build and deploy a sharded cluster.","112412","test_build_and_deploy","tests.integration.backup_tests","Wed Sep 04 01:33:20 UTC 2024","passed","Wed Sep 04 01:35:12 UTC 2024","","test_sharding_backups","",""
"Verifies connecting a shard to a mongos router fails.","0","test_shard_mongos_relation","tests.integration.sharding_tests","Wed Sep 04 01:37:14 UTC 2024","skipped","Wed Sep 04 01:37:14 UTC 2024","","test_sharding_relations","",""
"Tests removal of Mongodb primary and the reelection functionality.

    Verifies that after the primary server gets removed,
    a successful reelection happens.
    ","35950","test_replication_primary_reelection","tests.integration","Wed Sep 04 01:50:02 UTC 2024","passed","Wed Sep 04 01:50:38 UTC 2024","","test_charm","",""
"Tests that each cluster component can rotate TLS certs.","605976","test_rotate_tls","tests.integration.tls_tests","Wed Sep 04 01:42:56 UTC 2024","passed","Wed Sep 04 01:53:02 UTC 2024","","test_sharding_tls","",""
"Test shard removal.

    This test also verifies that:
    - Databases that are using this shard as a primary are moved.
    - The balancer is turned back on if turned off.
    - Config server supp    orts removing multiple shards.
    ","143707","test_shard_removal","tests.integration.sharding_tests","Wed Sep 04 01:44:24 UTC 2024","passed","Wed Sep 04 01:46:48 UTC 2024","","test_sharding","",""
